{
  "$schema": "../../schema/extension_schema.json",
  "layer": "L2_common_enterprise_extension",
  "version": "1.0.0",
  "extends": "L1_universal_organization_ontology",
  "description": "通用企业扩展概念包，包含从 L1 v2.0 下放的常见但非核心的概念：渠道、市场细分、地点、决策。这些概念在许多行业中通用，但不属于所有企业的必备抽象。",
  "classes": [
    {
      "id": "Channel",
      "label_zh": "渠道",
      "label_en": "Channel",
      "parent": "Resource",
      "definition": "与客户、伙伴或内部用户交互的渠道",
      "definition_en": "Channels for interacting with customers, partners, or internal users"
    },
    {
      "id": "MarketSegment",
      "label_zh": "市场细分",
      "label_en": "Market Segment",
      "parent": "Resource",
      "definition": "客户或市场的分类维度",
      "definition_en": "Classification dimensions for customers or markets"
    },
    {
      "id": "Location",
      "label_zh": "地点",
      "label_en": "Location",
      "parent": "Resource",
      "definition": "组织运营或交易发生的地点",
      "definition_en": "Places where organizational operations or transactions occur"
    },
    {
      "id": "Decision",
      "label_zh": "决策",
      "label_en": "Decision",
      "parent": "Event",
      "definition": "对事件、规则或目标做出的选择与批准，是事件的一种特殊类型",
      "definition_en": "Choices and approvals made regarding events, rules, or goals; a specialized type of Event"
    },
    {
      "id": "Activity",
      "label_zh": "活动",
      "label_en": "Activity",
      "parent": "Process",
      "definition": "流程中的可执行步骤，是流程的子类型",
      "definition_en": "An executable step within a process; a subtype of Process"
    },
    {
      "id": "Contract",
      "label_zh": "合同",
      "label_en": "Contract",
      "parent": "Document",
      "definition": "具有法律约束力的协议文档",
      "definition_en": "A legally binding agreement document"
    },
    {
      "id": "Report",
      "label_zh": "报告",
      "label_en": "Report",
      "parent": "Document",
      "definition": "结构化的分析报告或业务报告",
      "definition_en": "A structured analytical or business report"
    },
    {
      "id": "Project",
      "label_zh": "项目",
      "label_en": "Project",
      "parent": "Resource",
      "definition": "有明确起止时间、范围和目标的临时性工作组织",
      "definition_en": "A temporary work organization with defined scope, timeline, and objectives"
    },
    {
      "id": "Stakeholder",
      "label_zh": "利益相关方",
      "label_en": "Stakeholder",
      "parent": "Role",
      "definition": "对组织决策或项目有利益关系的角色",
      "definition_en": "A role with vested interest in organizational decisions or projects"
    },
    {
      "id": "Regulation",
      "label_zh": "法规",
      "label_en": "Regulation",
      "parent": "Policy",
      "definition": "来自外部监管机构的法律法规要求",
      "definition_en": "Legal and regulatory requirements from external regulatory bodies"
    }
  ],
  "relations": [
    {
      "id": "serves_through",
      "domain": "ProductService",
      "range": "Channel",
      "definition": "产品或服务通过渠道提供"
    },
    {
      "id": "targets_segment",
      "domain": "ProductService",
      "range": "MarketSegment",
      "definition": "产品或服务面向特定市场细分"
    },
    {
      "id": "located_at",
      "domain": "Organization",
      "range": "Location",
      "definition": "组织位于或运营在某个地点"
    },
    {
      "id": "results_in",
      "domain": "Decision",
      "range": "Event",
      "definition": "决策产生后续事件或行动"
    },
    {
      "id": "complies_with",
      "domain": "Process",
      "range": "Regulation",
      "definition": "流程符合法规要求"
    }
  ],
  "sample_instances": [
    {
      "id": "channel_online_store",
      "type": "Channel",
      "label": "Online Store"
    },
    {
      "id": "channel_retail_outlet",
      "type": "Channel",
      "label": "Retail Outlet"
    },
    {
      "id": "segment_enterprise_b2b",
      "type": "MarketSegment",
      "label": "Enterprise B2B"
    },
    {
      "id": "loc_headquarters",
      "type": "Location",
      "label": "Corporate Headquarters"
    },
    {
      "id": "decision_budget_approval",
      "type": "Decision",
      "label": "Annual Budget Approval"
    }
  ]
}
